{
  "accuracy_evidence": [
    {
      "dataset": "COCO val",
      "id": "accuracy:yolo26n:coco-val:map50-95",
      "metric": "mAP50-95",
      "model_revision_id": "revision:yolo26n:unresolved",
      "quality": "vendor-published",
      "source_date": "2026-08-16",
      "source_id": "ultralytics-yolo26-2026",
      "source_url": "https://docs.ultralytics.com/models/yolo26",
      "value": 40.9
    }
  ],
  "artifacts": [
    {
      "format": "onnx",
      "id": "artifact:yolo26n:onnx:fp32:unresolved",
      "identity_status": "unresolved",
      "model_revision_id": "revision:yolo26n:unresolved",
      "sha256": null,
      "source_url": "https://docs.ultralytics.com/guides/nvidia-jetson"
    },
    {
      "format": "pytorch",
      "id": "artifact:yolo26n:pytorch:fp32:unresolved",
      "identity_status": "unresolved",
      "model_revision_id": "revision:yolo26n:unresolved",
      "sha256": null,
      "source_url": "https://docs.ultralytics.com/guides/nvidia-jetson"
    },
    {
      "format": "tensorrt-engine",
      "id": "artifact:yolo26n:tensorrt:fp16:unresolved",
      "identity_status": "unresolved",
      "model_revision_id": "revision:yolo26n:unresolved",
      "sha256": null,
      "source_url": "https://docs.ultralytics.com/guides/nvidia-jetson"
    },
    {
      "format": "tensorrt-engine",
      "id": "artifact:yolo26n:tensorrt:fp32:unresolved",
      "identity_status": "unresolved",
      "model_revision_id": "revision:yolo26n:unresolved",
      "sha256": null,
      "source_url": "https://docs.ultralytics.com/guides/nvidia-jetson"
    },
    {
      "format": "tensorrt-engine",
      "id": "artifact:yolo26n:tensorrt:int8:unresolved",
      "identity_status": "unresolved",
      "model_revision_id": "revision:yolo26n:unresolved",
      "sha256": null,
      "source_url": "https://docs.ultralytics.com/guides/nvidia-jetson"
    }
  ],
  "benchmark_evidence": [
    {
      "artifact_id": "artifact:yolo26n:pytorch:fp32:unresolved",
      "batch_size": null,
      "clocks": {},
      "hardware_profile_id": "jetson-agx-thor-128gb",
      "id": "benchmark:jetson-agx-thor-128gb:pytorch:fp32",
      "input_shapes": {
        "image": [
          640,
          640
        ]
      },
      "iterations": null,
      "latency": {
        "max_ms": null,
        "mean_ms": 7.39,
        "median_ms": null,
        "min_ms": null,
        "p50_ms": null,
        "p90_ms": null,
        "p95_ms": null,
        "p99_ms": null,
        "stdev_ms": null
      },
      "model_revision_id": "revision:yolo26n:unresolved",
      "notes": "Vendor-published inference time at 640 input. Exact model revision and artifact hash are not identified upstream, so this is contextual evidence only.",
      "peak_memory_mb": null,
      "peak_memory_scope": null,
      "power": null,
      "power_mode": null,
      "quality": "vendor-published",
      "runtime_profile_id": "runtime:pytorch:fp32",
      "software_stack_id": "stack:jetson-agx-thor-128gb:ultralytics-jetson-2026",
      "source_date": "2026-08-16",
      "source_id": "ultralytics-jetson-2026",
      "source_url": "https://docs.ultralytics.com/guides/nvidia-jetson",
      "throughput_fps": null,
      "verified_identity": false,
      "warmup": null
    },
    {
      "artifact_id": "artifact:yolo26n:onnx:fp32:unresolved",
      "batch_size": null,
      "clocks": {},
      "hardware_profile_id": "jetson-agx-thor-128gb",
      "id": "benchmark:jetson-agx-thor-128gb:onnx:fp32",
      "input_shapes": {
        "image": [
          640,
          640
        ]
      },
      "iterations": null,
      "latency": {
        "max_ms": null,
        "mean_ms": 6.58,
        "median_ms": null,
        "min_ms": null,
        "p50_ms": null,
        "p90_ms": null,
        "p95_ms": null,
        "p99_ms": null,
        "stdev_ms": null
      },
      "model_revision_id": "revision:yolo26n:unresolved",
      "notes": "Vendor-published inference time at 640 input. Exact model revision and artifact hash are not identified upstream, so this is contextual evidence only.",
      "peak_memory_mb": null,
      "peak_memory_scope": null,
      "power": null,
      "power_mode": null,
      "quality": "vendor-published",
      "runtime_profile_id": "runtime:onnx:fp32",
      "software_stack_id": "stack:jetson-agx-thor-128gb:ultralytics-jetson-2026",
      "source_date": "2026-08-16",
      "source_id": "ultralytics-jetson-2026",
      "source_url": "https://docs.ultralytics.com/guides/nvidia-jetson",
      "throughput_fps": null,
      "verified_identity": false,
      "warmup": null
    },
    {
      "artifact_id": "artifact:yolo26n:tensorrt:fp32:unresolved",
      "batch_size": null,
      "clocks": {},
      "hardware_profile_id": "jetson-agx-thor-128gb",
      "id": "benchmark:jetson-agx-thor-128gb:tensorrt:fp32",
      "input_shapes": {
        "image": [
          640,
          640
        ]
      },
      "iterations": null,
      "latency": {
        "max_ms": null,
        "mean_ms": 1.9,
        "median_ms": null,
        "min_ms": null,
        "p50_ms": null,
        "p90_ms": null,
        "p95_ms": null,
        "p99_ms": null,
        "stdev_ms": null
      },
      "model_revision_id": "revision:yolo26n:unresolved",
      "notes": "Vendor-published inference time at 640 input. Exact model revision and artifact hash are not identified upstream, so this is contextual evidence only.",
      "peak_memory_mb": null,
      "peak_memory_scope": null,
      "power": null,
      "power_mode": null,
      "quality": "vendor-published",
      "runtime_profile_id": "runtime:tensorrt:fp32",
      "software_stack_id": "stack:jetson-agx-thor-128gb:ultralytics-jetson-2026",
      "source_date": "2026-08-16",
      "source_id": "ultralytics-jetson-2026",
      "source_url": "https://docs.ultralytics.com/guides/nvidia-jetson",
      "throughput_fps": null,
      "verified_identity": false,
      "warmup": null
    },
    {
      "artifact_id": "artifact:yolo26n:tensorrt:fp16:unresolved",
      "batch_size": null,
      "clocks": {},
      "hardware_profile_id": "jetson-agx-thor-128gb",
      "id": "benchmark:jetson-agx-thor-128gb:tensorrt:fp16",
      "input_shapes": {
        "image": [
          640,
          640
        ]
      },
      "iterations": null,
      "latency": {
        "max_ms": null,
        "mean_ms": 1.39,
        "median_ms": null,
        "min_ms": null,
        "p50_ms": null,
        "p90_ms": null,
        "p95_ms": null,
        "p99_ms": null,
        "stdev_ms": null
      },
      "model_revision_id": "revision:yolo26n:unresolved",
      "notes": "Vendor-published inference time at 640 input. Exact model revision and artifact hash are not identified upstream, so this is contextual evidence only.",
      "peak_memory_mb": null,
      "peak_memory_scope": null,
      "power": null,
      "power_mode": null,
      "quality": "vendor-published",
      "runtime_profile_id": "runtime:tensorrt:fp16",
      "software_stack_id": "stack:jetson-agx-thor-128gb:ultralytics-jetson-2026",
      "source_date": "2026-08-16",
      "source_id": "ultralytics-jetson-2026",
      "source_url": "https://docs.ultralytics.com/guides/nvidia-jetson",
      "throughput_fps": null,
      "verified_identity": false,
      "warmup": null
    },
    {
      "artifact_id": "artifact:yolo26n:tensorrt:int8:unresolved",
      "batch_size": null,
      "clocks": {},
      "hardware_profile_id": "jetson-agx-thor-128gb",
      "id": "benchmark:jetson-agx-thor-128gb:tensorrt:int8",
      "input_shapes": {
        "image": [
          640,
          640
        ]
      },
      "iterations": null,
      "latency": {
        "max_ms": null,
        "mean_ms": 1.52,
        "median_ms": null,
        "min_ms": null,
        "p50_ms": null,
        "p90_ms": null,
        "p95_ms": null,
        "p99_ms": null,
        "stdev_ms": null
      },
      "model_revision_id": "revision:yolo26n:unresolved",
      "notes": "Vendor-published inference time at 640 input. Exact model revision and artifact hash are not identified upstream, so this is contextual evidence only.",
      "peak_memory_mb": null,
      "peak_memory_scope": null,
      "power": null,
      "power_mode": null,
      "quality": "vendor-published",
      "runtime_profile_id": "runtime:tensorrt:int8",
      "software_stack_id": "stack:jetson-agx-thor-128gb:ultralytics-jetson-2026",
      "source_date": "2026-08-16",
      "source_id": "ultralytics-jetson-2026",
      "source_url": "https://docs.ultralytics.com/guides/nvidia-jetson",
      "throughput_fps": null,
      "verified_identity": false,
      "warmup": null
    },
    {
      "artifact_id": "artifact:yolo26n:pytorch:fp32:unresolved",
      "batch_size": null,
      "clocks": {},
      "hardware_profile_id": "jetson-agx-orin-64gb",
      "id": "benchmark:jetson-agx-orin-64gb:pytorch:fp32",
      "input_shapes": {
        "image": [
          640,
          640
        ]
      },
      "iterations": null,
      "latency": {
        "max_ms": null,
        "mean_ms": 11.58,
        "median_ms": null,
        "min_ms": null,
        "p50_ms": null,
        "p90_ms": null,
        "p95_ms": null,
        "p99_ms": null,
        "stdev_ms": null
      },
      "model_revision_id": "revision:yolo26n:unresolved",
      "notes": "Vendor-published inference time at 640 input. Exact model revision and artifact hash are not identified upstream, so this is contextual evidence only.",
      "peak_memory_mb": null,
      "peak_memory_scope": null,
      "power": null,
      "power_mode": null,
      "quality": "vendor-published",
      "runtime_profile_id": "runtime:pytorch:fp32",
      "software_stack_id": "stack:jetson-agx-orin-64gb:ultralytics-jetson-2026",
      "source_date": "2026-08-16",
      "source_id": "ultralytics-jetson-2026",
      "source_url": "https://docs.ultralytics.com/guides/nvidia-jetson",
      "throughput_fps": null,
      "verified_identity": false,